{"requestId":"decision-1","apiVersion":3,"clientIdentity":{"name":"example-host","version":"1.0.0"},"partitionKey":"default","capability":"org.example.route.decide","deadlineUnixMs":10000,"featureSchemaHash":"99c44934c1bfca8fdffb93122d29418d7fe7eb0d81d80f8b2bf4fbdd153151ab","modelGeneration":7,"stateGeneration":9,"payloadLimit":1048576,"request":{"method":"decide","context":{"actions":[{"features":[1.0,2.0],"id":"route-a"}]},"deterministicSeed":42}}
